{
  "schemaVersion": "1.0",
  "image": {
    "repository": "codinglair/codinglair-taf-mcp",
    "releaseTag": "1.3.1",
    "entrypoint": "/opt/taf/bin/taf-mcp",
    "contents": [
      "Java 25 runtime",
      "TAF MCP contracts, jobs, security, resources, tools, and prompts",
      "STDIO and Streamable HTTP transport adapters",
      "TAF Runtime including Apple Appium discovery and validation contracts",
      "isolated execution-worker launcher for authorized Apple fixtures",
      "license, SBOM, provenance, and compatibility metadata"
    ]
  },
  "artifactCompatibility": {
    "tafRelease": "1.3.1",
    "mcpSchemaMajor": 1,
    "javaRuntime": 25
  },
  "supportedProfiles": [
    "stdio",
    "streamable-http"
  ]
}
